{"check_count":37,"checks":[{"category":"formal_schema","check_id":"schema:artifacts/m19/execution/m16-rtl-execution-trace.json","status":"PASS"},{"category":"serialization","check_id":"canonical:artifacts/m19/execution/m16-rtl-execution-trace.json","status":"PASS"},{"category":"formal_schema","check_id":"schema:artifacts/m19/execution/m16-fpga-preparation-execution-trace.json","status":"PASS"},{"category":"serialization","check_id":"canonical:artifacts/m19/execution/m16-fpga-preparation-execution-trace.json","status":"PASS"},{"category":"formal_schema","check_id":"schema:artifacts/m19/qualification/m16-rtl-zero-event-qualification.json","status":"PASS"},{"category":"serialization","check_id":"canonical:artifacts/m19/qualification/m16-rtl-zero-event-qualification.json","status":"PASS"},{"category":"formal_schema","check_id":"schema:artifacts/m19/qualification/m16-fpga-preparation-zero-event-qualification.json","status":"PASS"},{"category":"serialization","check_id":"canonical:artifacts/m19/qualification/m16-fpga-preparation-zero-event-qualification.json","status":"PASS"},{"category":"formal_schema","check_id":"schema:artifacts/m19/qualification/m16-rtl-qualification-manifest.json","status":"PASS"},{"category":"serialization","check_id":"canonical:artifacts/m19/qualification/m16-rtl-qualification-manifest.json","status":"PASS"},{"category":"formal_schema","check_id":"schema:artifacts/m19/qualification/m16-fpga-preparation-qualification-manifest.json","status":"PASS"},{"category":"serialization","check_id":"canonical:artifacts/m19/qualification/m16-fpga-preparation-qualification-manifest.json","status":"PASS"},{"category":"formal_schema","check_id":"schema:manifest","status":"PASS"},{"category":"manifest","check_id":"manifest:artifact_count","status":"PASS"},{"category":"manifest","check_id":"manifest:artifact_digest","status":"PASS"},{"category":"manifest","check_id":"manifest:source_digest","status":"PASS"},{"category":"execution","check_id":"rtl:record_count","status":"PASS"},{"category":"execution","check_id":"rtl:epoch_profile","status":"PASS"},{"category":"invariant","check_id":"rtl:zero_events","status":"PASS"},{"category":"invariant","check_id":"rtl:invariant_vectors","status":"PASS"},{"category":"digest","check_id":"rtl:raw_digest","status":"PASS"},{"category":"digest","check_id":"rtl:record_digest","status":"PASS"},{"category":"manifest","check_id":"rtl:layer_manifest","status":"PASS"},{"category":"provenance","check_id":"rtl:qualified_source","status":"PASS"},{"category":"contour","check_id":"rtl:measurement_contours","status":"PASS"},{"category":"execution","check_id":"fpga:record_count","status":"PASS"},{"category":"execution","check_id":"fpga:epoch_profile","status":"PASS"},{"category":"invariant","check_id":"fpga:zero_events","status":"PASS"},{"category":"invariant","check_id":"fpga:invariant_vectors","status":"PASS"},{"category":"digest","check_id":"fpga:raw_digest","status":"PASS"},{"category":"digest","check_id":"fpga:record_digest","status":"PASS"},{"category":"manifest","check_id":"fpga:layer_manifest","status":"PASS"},{"category":"provenance","check_id":"fpga:qualified_source","status":"PASS"},{"category":"contour","check_id":"fpga:measurement_contours","status":"PASS"},{"category":"semantic","check_id":"ternary:canonical_domain","status":"PASS"},{"category":"semantic","check_id":"active_neutral:no_direct_transition","status":"PASS"},{"category":"provenance","check_id":"sources:current_bytes","status":"PASS"}],"failed_count":0,"kind":"m19_machine_readable_evidence_qualification","manifest_path":"artifacts/m19/manifests/m19-machine-readable-evidence-manifest.json","manifest_raw_sha256":"b82d8318e7d5fc375c111e342f841b7842571bb0cce4ede5da14e1383ee98fb7","milestone":"M19 — Machine-Readable M16 Execution and Qualification Evidence","overall_status":"PASS","passed_count":37,"schema":"frp.m19.machine_readable_evidence_qualification.v2.1.0","version":"2.1.0"}
